{
  "file": "src/assets/illustrations/operator-console-crt.svg",
  "author": "PLC Museum (original illustration)",
  "license": "original-illustration",
  "source_url": null,
  "attribution_text": "Illustration: PLC Museum, CC BY 4.0",
  "permission_evidence": null,
  "modifications": ["none"],
  "shows_logo": false,
  "added": "2026-10-15"
}
