{
  "file": "content/images/ab-plc-5/silhouette.svg",
  "author": "PLC Museum (original illustration)",
  "license": "original-illustration",
  "source_url": null,
  "attribution_text": "Illustration: PLC Museum, CC BY 4.0",
  "permission_evidence": null,
  "modifications": ["none"],
  "shows_logo": false,
  "added": "2026-10-14"
}
